{
  "schema_version": 1,
  "project": "afuza.id",
  "target": "staging",
  "status": "EXECUTION_FOUNDATION_COMPLETE",
  "active_workstream": "AX-01",
  "current_task": null,
  "completed_tasks": 0,
  "total_tasks": 0,
  "quality_gates": {
    "configuration_schema": "PASS",
    "lint": "PASS",
    "typecheck": "PASS",
    "tests": "PASS",
    "build": "PASS",
    "staging_smoke": "PASS"
  },
  "blockers": [],
  "approvals_required": [],
  "last_execution": {
    "command": "verify",
    "result": "PASS",
    "started_at": "2026-10-02T18:31:40.651Z",
    "finished_at": "2026-10-02T18:32:45.558Z"
  },
  "updated_at": "2026-10-02T18:32:45.558Z"
}
